{
  "project_code": "FIXTURE",
  "work_item_id": "FIXTURE-RUNTIME-001",
  "generated_from": [
    "inputs/images/FIXTURE-RUNTIME-001-01_副本.png",
    "inputs/images/FIXTURE-RUNTIME-001-02_副本.png",
    "inputs/images/FIXTURE-RUNTIME-001-03-01_副本.png",
    "inputs/images/FIXTURE-RUNTIME-001-03-02_副本.png",
    "inputs/images/FIXTURE-RUNTIME-001-03-03_副本.png",
    "inputs/images/FIXTURE-RUNTIME-001-04_副本.png"
  ],
  "evidence_items": []
}
